<?xml version="1.0" encoding="UTF-8"?>
<manifest xmlns:xsi="http://www.w3.org/2001/XMLSchema-instance"
          xsi:noNamespaceSchemaLocation="../../../../../../../src/Core/Content/App/Manifest/Schema/manifest-1.0.xsd">
    <meta>
        <name>E2E_Product</name>
        <label>E2E_Product_label_en</label>
        <label lang="de-DE">E2E_Product_label_de</label>
        <description>Test for app system</description>
        <description lang="de-DE">Test f√ºr Appsystem</description>
        <author>shopware AG</author>
        <copyright>(c) by shopware AG</copyright>
        <version>1.0.0</version>
        <icon>icon.png</icon>
    </meta>
    <admin>
        <action-button
            action="viewProduct"
            entity="product"
            view="detail"
            url="https://swag-test.com/your-product"
            openNewTab="false">
            <label>Action product detail</label>
            <label lang="de-DE">Aktion Produktdetailseite</label>
        </action-button>
        <action-button
            action="viewProductExtern"
            entity="product"
            view="detail"
            url="https://swag-test.com/your-order"
            openNewTab="true">
            <label>Action product detail external</label>
            <label lang="de-DE">Aktion Produktdetailseite extern</label>
        </action-button>
        <action-button
            action="doStuffWithProducts"
            entity="product"
            view="index"
            url="https://swag-test.com/do-stuff">
            <label>Do Stuff with products</label>
        </action-button>
    </admin>
</manifest>
